{
  "id": "pm_2025-09-payments",
  "source_type": "postmortem",
  "content": "At 02:03 we restarted payments-api during the nightly batch window...",
  "url": "gh:acme/infra/postmortems/2025-09-payments.md",
  "author": "sre-lead",
  "created_at": "2025-09-12T02:15:00Z",
  "content_hash": "sha256:d40ff53cd83e33e8f5253860a0960a114c0e2bf7e43ff09ccf078830c78c43e9",
  "metadata": { "repo": "acme/infra" }
}
